{
  "version": "1.3",
  "endedAt": "2025-10-22T15:58:13+00:00",
  "actor": "Cursor{Implementer}",
  "authority": "BossCat OEM",
  "verdict": "READY",
  "gate": 8,
  "remediation": true,
  "evidence": [
    "DELT/ARTF/gate-verification-results-20251022-remediated.json",
    "docs/gate/2025-10/GATE_008_BLOCKED_STATUS.md",
    "GATE_008_REMEDIATION_COMPLETE.md",
    "docs/GATE_STATUS_DASHBOARD.md"
  ],
  "checks": [
    {
      "name": "windows_collector_service",
      "ok": true,
      "remediated": true,
      "previous": "STOPPED (BLOCKER)",
      "current": "RUNNING",
      "details": {
        "service": "otelcol-contrib",
        "status": "Running",
        "metricsPort": "8888 - SERVING"
      }
    },
    {
      "name": "docker_containers",
      "ok": true,
      "corrected": true,
      "previous": "4 (INCORRECT)",
      "current": 7,
      "details": {
        "containers": [
          "signoz-otel-collector",
          "signoz",
          "otel-gpu-aggregation",
          "otel-gpu-compression",
          "otel-gpu-inference",
          "signoz-clickhouse",
          "signoz-zookeeper"
        ]
      }
    },
    {
      "name": "html_files",
      "ok": true,
      "corrected": true,
      "previous": "42 (INCORRECT)",
      "current": 51,
      "details": {
        "verification": "git ls-files '*.html' | measure-object"
      }
    },
    {
      "name": "pipeline_verification",
      "ok": true,
      "details": {
        "canaryTest": "PASS",
        "verifyPipeline": "PASS",
        "logsInClickHouse": "Fresh logs 2025-10-22 10:10:20"
      }
    },
    {
      "name": "working_tree",
      "ok": true,
      "details": {
        "status": "Clean (post-approval)",
        "action": "All artifacts committed and pushed"
      }
    }
  ],
  "reasons": [
    "Gate #008 remediation complete - Windows Collector enabled and running",
    "All metrics corrected to match reality (7 containers, 51 HTML files)",
    "Pipeline verification successful with fresh canary logs",
    "Documentation updated across all gate artifacts"
  ],
  "branch": "main",
  "commit": "4bf509bb",
  "previousCommit": "09109664e (approval)",
  "originalCommit": "327dd382f (initial, retracted)",
  "gatePhrase": "@cat ready-for-gate (APPROVED)",
  "automated": false,
  "manual": true
}
